"competition_name","category_name"
"ITF Turkey F2, Men Doubles","ITF Men"
"ITF USA F4, Men Singles","ITF Men"
"ITF USA F4, Men Doubles","ITF Men"
"ITF Germany F3, Men Singles","ITF Men"
"ITF Germany F3, Men Doubles","ITF Men"
"ITF Kazakhstan F1, Men Singles","ITF Men"
"ITF Kazakhstan F1, Men Doubles","ITF Men"
"ITF Egypt F2, Men Singles","ITF Men"
"ITF Egypt F2, Men Doubles","ITF Men"
"ITF France F3, Men Singles","ITF Men"
"ITF France F3, Men Doubles","ITF Men"
"ITF Spain F2, Men Singles","ITF Men"
"ITF Spain F2, Men Doubles","ITF Men"
"ITF Tunisia F3, Men Singles","ITF Men"
"ITF Tunisia F3, Men Doubles","ITF Men"
"ITF Turkey F3, Men Singles","ITF Men"
"ITF Turkey F3, Men Doubles","ITF Men"
"ITF Belgium F4, Men Singles","ITF Men"
"ITF Belgium F4, Men Doubles","ITF Men"
"ITF Portugal F11, Men Singles","ITF Men"
"ITF Portugal F11, Men Doubles","ITF Men"
"ITF USA F5, Men Singles","ITF Men"
"ITF USA F5, Men Doubles","ITF Men"
"ITF Kazakhstan F2, Men Singles","ITF Men"
"ITF Kazakhstan F2, Men Doubles","ITF Men"
"ITF Egypt F3, Men Singles","ITF Men"
"ITF Egypt F3, Men Doubles","ITF Men"
"ITF Portugal F1, Men Doubles","ITF Men"
"ITF Turkey F4, Men Singles","ITF Men"
"ITF USA F6, Men Singles","ITF Men"
"ITF Switzerland F1, Men Singles","ITF Men"
"ITF Egypt F4, Men Singles","ITF Men"
"ITF Great Britain F2, Men Singles","ITF Men"
"ITF Indonesia F1, Men Singles","ITF Men"
"ITF Spain F4, Men Doubles","ITF Men"
"ITF Tunisia F5, Men Singles","ITF Men"
"ITF Turkey F5, Men Singles","ITF Men"
"ITF Egypt F7, Men Singles","ITF Men"
"ITF Tunisia F8, Men Singles","ITF Men"
"ITF Turkey F8, Men Singles","ITF Men"
"ITF Great Britain F1, Men Singles","ITF Men"
"ITF Great Britain F1, Men Doubles","ITF Men"
"ITF China F13, Men Singles","ITF Men"
"ITF China F13, Men Doubles","ITF Men"
"ITF Czech Republic F6, Men Singles","ITF Men"
"ITF Czech Republic F6, Men Doubles","ITF Men"
"ITF Germany F8, Men Singles","ITF Men"
"ITF Germany F8, Men Doubles","ITF Men"
"ITF Ireland F1, Men Singles","ITF Men"
"ITF Ireland F1, Men Doubles","ITF Men"
"ITF Spain F22, Men Singles","ITF Men"
"ITF Spain F22, Men Doubles","ITF Men"
"ITF Turkey F26, Men Singles","ITF Men"
"ITF Turkey F26, Men Doubles","ITF Men"
"ITF USA F24, Men Singles","ITF Men"
"ITF USA F24, Men Doubles","ITF Men"
"ITF Austria F3, Men Singles","ITF Men"
"ITF Austria F3, Men Doubles","ITF Men"
"ITF Belgium F5, Men Singles","ITF Men"
"ITF Belgium F5, Men Doubles","ITF Men"
"ITF Colombia F1, Men Singles","ITF Men"
"ITF Colombia F1, Men Doubles","ITF Men"
"ITF Egypt F21, Men Singles","ITF Men"
"ITF Egypt F21, Men Doubles","ITF Men"
"ITF France F16, Men Singles","ITF Men"
"ITF France F16, Men Doubles","ITF Men"
"ITF Georgia F3, Men Singles","ITF Men"
"ITF Georgia F3, Men Doubles","ITF Men"
"ITF Italy F22, Men Singles","ITF Men"
"ITF Italy F22, Men Doubles","ITF Men"
"ITF Lithuania F1, Men Singles","ITF Men"
"ITF Lithuania F1, Men Doubles","ITF Men"
"ITF Morocco F1, Men Singles","ITF Men"
"ITF Morocco F1, Men Doubles","ITF Men"
"ITF Poland F6, Men Singles","ITF Men"
"ITF Poland F6, Men Doubles","ITF Men"
"ITF Portugal F12, Men Singles","ITF Men"
"ITF Portugal F12, Men Doubles","ITF Men"
"ITF Spain F3, Men Singles","ITF Men"
"ITF Spain F3, Men Doubles","ITF Men"
"ITF Tunisia F4, Men Singles","ITF Men"
"ITF Tunisia F4, Men Doubles","ITF Men"
"ITF Kazakhstan 05A, Women Singles","ITF Women"
"ITF Kazakhstan 05A, Women Doubles","ITF Women"
"ITF Czech Republic 03A, Women Singles","ITF Women"
"ITF Czech Republic 03A, Women Doubles","ITF Women"
"ITF Turkey 28A, Women Singles","ITF Women"
"ITF Turkey 28A, Women Doubles","ITF Women"
"ITF USA 22A, Women Singles","ITF Women"
"ITF USA 22A, Women Doubles","ITF Women"
"ITF Canada 05A, Women Singles","ITF Women"
"ITF Canada 05A, Women Doubles","ITF Women"
"ITF China 14A, Women Singles","ITF Women"
"ITF China 14A, Women Doubles","ITF Women"
"ITF Germany 10A, Women Singles","ITF Women"
"ITF Germany 10A, Women Doubles","ITF Women"
"ITF Italy 19A, Women Singles","ITF Women"
"ITF Italy 19A, Women Doubles","ITF Women"
"ITF Belgium 01A, Women Singles","ITF Women"
"ITF Belgium 01A, Women Doubles","ITF Women"
"ITF Egypt 21A, Women Singles","ITF Women"
"ITF Egypt 21A, Women Doubles","ITF Women"
"ITF Romania 05A, Women Singles","ITF Women"
"ITF Romania 05A, Women Doubles","ITF Women"
"ITF Spain 11A, Women Singles","ITF Women"
"ITF Spain 11A, Women Doubles","ITF Women"
"ITF Thailand 05A, Women Singles","ITF Women"
"ITF Thailand 05A, Women Doubles","ITF Women"
"ITF China F14, Men Singles","ITF Men"
"ITF China F14, Men Doubles","ITF Men"
"ITF France F17, Men Singles","ITF Men"
"ITF France F17, Men Doubles","ITF Men"
"ITF Ireland F2, Men Singles","ITF Men"
"ITF Ireland F2, Men Doubles","ITF Men"
"ITF Italy F23, Men Singles","ITF Men"
"ITF Italy F23, Men Doubles","ITF Men"
"ITF Spain F23, Men Singles","ITF Men"
"ITF Spain F23, Men Doubles","ITF Men"
"ITF USA F25, Men Singles","ITF Men"
"ITF USA F25, Men Doubles","ITF Men"
"ITF Austria F4, Men Singles","ITF Men"
"ITF Austria F4, Men Doubles","ITF Men"
"ITF Belgium F6, Men Singles","ITF Men"
"ITF Belgium F6, Men Doubles","ITF Men"
"ITF Colombia F2, Men Singles","ITF Men"
"ITF Colombia F2, Men Doubles","ITF Men"
"ITF Egypt F22, Men Singles","ITF Men"
"ITF Egypt F22, Men Doubles","ITF Men"
"ITF Estonia F1, Men Singles","ITF Men"
"ITF Estonia F1, Men Doubles","ITF Men"
"ITF Macedonia F1, Men Singles","ITF Men"
"ITF Macedonia F1, Men Doubles","ITF Men"
"ITF Morocco F2, Men Singles","ITF Men"
"ITF Morocco F2, Men Doubles","ITF Men"
"ITF Poland F7, Men Singles","ITF Men"
"ITF Poland F7, Men Doubles","ITF Men"
"ITF Portugal F13, Men Singles","ITF Men"
"ITF Portugal F13, Men Doubles","ITF Men"
"ITF Romania F7, Men Singles","ITF Men"
"ITF Romania F7, Men Doubles","ITF Men"
"ITF Russia F4, Men Singles","ITF Men"
"ITF Russia F4, Men Doubles","ITF Men"
"ITF Slovakia F1, Men Singles","ITF Men"
"ITF Slovakia F1, Men Doubles","ITF Men"
"ITF Turkiye F27, Men Singles","ITF Men"
"ITF Turkiye F27, Men Doubles","ITF Men"
"ITF Czechia 04A, Women Singles","ITF Women"
"ITF Czechia 04A, Women Doubles","ITF Women"
"ITF Canada 06A, Women Singles","ITF Women"
"ITF Canada 06A, Women Doubles","ITF Women"
"ITF USA 26A, Women Singles","ITF Women"
"ITF USA 26A, Women Doubles","ITF Women"
"ITF Germany 11A, Women Singles","ITF Women"
"ITF Germany 11A, Women Doubles","ITF Women"
"ITF Thailand 06A, Women Singles","ITF Women"
"ITF Thailand 06A, Women Doubles","ITF Women"
"ITF Brazil 07A, Women Singles","ITF Women"
"ITF Brazil 07A, Women Doubles","ITF Women"
"ITF Egypt 22A, Women Singles","ITF Women"
"ITF Egypt 22A, Women Doubles","ITF Women"
"ITF Estonia 01A, Women Singles","ITF Women"
"ITF Estonia 01A, Women Doubles","ITF Women"
"ITF Finland 01A, Women Singles","ITF Women"
"ITF Finland 01A, Women Doubles","ITF Women"
"ITF France 20A, Women Singles","ITF Women"
"ITF France 20A, Women Doubles","ITF Women"
"ITF Ireland 01A, Women Singles","ITF Women"
"ITF Ireland 01A, Women Doubles","ITF Women"
"ITF Italy 20A, Women Singles","ITF Women"
"ITF Italy 20A, Women Doubles","ITF Women"
"ITF Romania 06A, Women Singles","ITF Women"
"ITF Romania 06A, Women Doubles","ITF Women"
"ITF USA 27A, Women Singles","ITF Women"
"ITF USA 27A, Women Doubles","ITF Women"
"ITF Turkey F4, Men Doubles","ITF Men"
"ITF Egypt F4, Men Doubles","ITF Men"
"ITF Great Britain F2, Men Doubles","ITF Men"
"ITF Indonesia F1, Men Doubles","ITF Men"
"ITF Latvia F1, Men Singles","ITF Men"
"ITF Latvia F1, Men Doubles","ITF Men"
"ITF Ukraine 01A, Women Singles","ITF Women"
"ITF Ukraine 01A, Women Doubles","ITF Women"
"ITF Portugal F14, Men Singles","ITF Men"
"ITF Portugal F14, Men Doubles","ITF Men"
"ITF Romania F8, Men Doubles","ITF Men"
"ITF Romania F8, Men Singles","ITF Men"
"ITF Turkiye F28, Men Singles","ITF Men"
"ITF Turkiye F28, Men Doubles","ITF Men"
"ITF USA F26, Men Doubles","ITF Men"
"ITF USA F26, Men Singles","ITF Men"
"ITF Austria F5, Men Singles","ITF Men"
"ITF Austria F5, Men Doubles","ITF Men"
"ITF Belgium F7, Men Doubles","ITF Men"
"ITF Belgium F7, Men Singles","ITF Men"
"ITF Colombia F3, Men Singles","ITF Men"
"ITF Colombia F3, Men Doubles","ITF Men"
"ITF Egypt F23, Men Singles","ITF Men"
"ITF Egypt F23, Men Doubles","ITF Men"
"ITF Macedonia F2, Men Doubles","ITF Men"
"ITF Macedonia F2, Men Singles","ITF Men"
"ITF Germany F9, Men Singles","ITF Men"
"ITF Germany F9, Men Doubles","ITF Men"
"ITF Morocco F3, Men Singles","ITF Men"
"ITF Morocco F3, Men Doubles","ITF Men"
"ITF Poland F8, Men Singles","ITF Men"
"ITF Poland F8, Men Doubles","ITF Men"
"ITF Russia F5, Men Singles","ITF Men"
"ITF Russia F5, Men Doubles","ITF Men"
"ITF Slovakia F2, Men Doubles","ITF Men"
"ITF Slovakia F2, Men Singles","ITF Men"
"ITF Thailand F4, Men Singles","ITF Men"
"ITF Thailand F4, Men Doubles","ITF Men"
"ITF USA 23A, Women Singles","ITF Women"
"ITF USA 23A, Women Doubles","ITF Women"
"ITF Germany 12A, Women Singles","ITF Women"
"ITF Germany 12A, Women Doubles","ITF Women"
"ITF Great Britain 12A, Women Singles","ITF Women"
"ITF Great Britain 12A, Women Doubles","ITF Women"
"ITF Spain 14A, Women Singles","ITF Women"
"ITF Spain 14A, Women Doubles","ITF Women"
"ITF USA 24A, Women Singles","ITF Women"
"ITF USA 24A, Women Doubles","ITF Women"
"ITF Egypt 23A, Women Singles","ITF Women"
"ITF Egypt 23A, Women Doubles","ITF Women"
"ITF Finland 02A, Women Doubles","ITF Women"
"ITF Finland 02A, Women Singles","ITF Women"
"ITF Romania 07A, Women Singles","ITF Women"
"ITF Romania 07A, Women Doubles","ITF Women"
"ITF Thailand 10A, Women Singles","ITF Women"
"ITF Thailand 10A, Women Doubles","ITF Women"
"ITF Turkiye 27A, Women Doubles","ITF Women"
"ITF Turkiye 27A, Women Singles","ITF Women"
"ITF Spain F4, Men Singles","ITF Men"
"ITF Tunisia F5, Men Doubles","ITF Men"
"ITF Turkey F5, Men Doubles","ITF Men"
"ITF China F1, Men Singles","ITF Men"
"ITF China F1, Men Doubles","ITF Men"
"ITF Egypt F5, Men Singles","ITF Men"
"ITF Egypt F5, Men Doubles","ITF Men"
"ITF Great Britain F3, Men Singles","ITF Men"
"ITF Great Britain F3, Men Doubles","ITF Men"
"ITF India F1, Men Singles","ITF Men"
"ITF India F1, Men Doubles","ITF Men"
"ITF Spain F5, Men Singles","ITF Men"
"ITF Spain F5, Men Doubles","ITF Men"
"ITF Tunisia F6, Men Singles","ITF Men"
"ITF Tunisia F6, Men Doubles","ITF Men"
"ITF Portugal 09A, Women Doubles","ITF Women"
"ITF Portugal 09A, Women Singles","ITF Women"
"ITF Portugal 07A, Women Singles","ITF Women"
"ITF Poland 03A, Women Singles","ITF Women"
"ITF Poland 03A, Women Doubles","ITF Women"
"ITF Italy F25, Men Singles","ITF Men"
"ITF Italy F25, Men Doubles","ITF Men"
"ITF USA F27, Men Singles","ITF Men"
"ITF USA F27, Men Doubles","ITF Men"
"ITF Germany 07A, Women Singles","ITF Women"
"ITF Germany 07A, Women Doubles","ITF Women"
"ITF Austria F6, Men Singles","ITF Men"
"ITF Austria F6, Men Doubles","ITF Men"
"ITF Belarus F1, Men Singles","ITF Men"
"ITF Belarus F1, Men Doubles","ITF Men"
"ITF Belgium F8, Men Singles","ITF Men"
"ITF Belgium F8, Men Doubles","ITF Men"
"ITF Finland F2, Men Singles","ITF Men"
"ITF Finland F2, Men Doubles","ITF Men"
"ITF Germany F10, Men Singles","ITF Men"
"ITF Germany F10, Men Doubles","ITF Men"
"ITF Portugal F15, Men Singles","ITF Men"
"ITF Portugal F15, Men Doubles","ITF Men"
"ITF Romania F9, Men Singles","ITF Men"
"ITF Romania F9, Men Doubles","ITF Men"
"ITF Russia F6, Men Singles","ITF Men"
"ITF Russia F6, Men Doubles","ITF Men"
"ITF Serbia F1, Men Singles","ITF Men"
"ITF Serbia F1, Men Doubles","ITF Men"
"ITF Slovakia F3, Men Singles","ITF Men"
"ITF Slovakia F3, Men Doubles","ITF Men"
"ITF Thailand F5, Men Singles","ITF Men"
"ITF Thailand F5, Men Doubles","ITF Men"
"ITF Turkiye F29, Men Singles","ITF Men"
"ITF Turkiye F29, Men Doubles","ITF Men"
"ITF Belgium 04A, Women Singles","ITF Women"
"ITF Belgium 04A, Women Doubles","ITF Women"
"ITF Great Britain 13A, Women Singles","ITF Women"
"ITF Great Britain 13A, Women Doubles","ITF Women"
"ITF USA 25A, Women Singles","ITF Women"
"ITF USA 25A, Women Doubles","ITF Women"
"ITF Austria 01A, Women Singles","ITF Women"
"ITF Austria 01A, Women Doubles","ITF Women"
"ITF Romania 08A, Women Singles","ITF Women"
"ITF Romania 08A, Women Doubles","ITF Women"
"ITF Russia 05A, Women Singles","ITF Women"
"ITF Russia 05A, Women Doubles","ITF Women"
"ITF Spain 12A, Women Singles","ITF Women"
"ITF Spain 12A, Women Doubles","ITF Women"
"ITF Thailand 11A, Women Doubles","ITF Women"
"ITF Thailand 11A, Women Singles","ITF Women"
"ITF Turkey 28B, Women Singles","ITF Women"
"ITF Turkey 28B, Women Doubles","ITF Women"
"ITF Turkey F6, Men Singles","ITF Men"
"ITF Turkey F6, Men Doubles","ITF Men"
"ITF USA F7, Men Singles","ITF Men"
"ITF USA F7, Men Doubles","ITF Men"
"ITF China F2, Men Singles","ITF Men"
"ITF China F2, Men Doubles","ITF Men"
"ITF Tunisia F7, Men Singles","ITF Men"
"ITF Tunisia F7, Men Doubles","ITF Men"
"ITF Egypt F6, Men Singles","ITF Men"
"ITF Egypt F6, Men Doubles","ITF Men"
"ITF Turkey F7, Men Singles","ITF Men"
"ITF Turkey F7, Men Doubles","ITF Men"
"ITF USA F8, Men Singles","ITF Men"
"ITF USA F8, Men Doubles","ITF Men"
"ITF Indonesia F3, Men Singles","ITF Men"
"ITF Indonesia F3, Men Doubles","ITF Men"
"ITF Canada F1, Men Singles","ITF Men"
"ITF Canada F1, Men Doubles","ITF Men"
"ITF France F4, Men Singles","ITF Men"
"ITF France F4, Men Doubles","ITF Men"
"ITF Italy F2, Men Singles","ITF Men"
"ITF Italy F2, Men Doubles","ITF Men"
"ITF China F3, Men Singles","ITF Men"
"ITF China F3, Men Doubles","ITF Men"
"ITF Egypt F7, Men Doubles","ITF Men"
"ITF Portugal F1, Men Singles","ITF Men"
"ITF Tunisia F8, Men Doubles","ITF Men"
"ITF Turkey F8, Men Doubles","ITF Men"
"ITF Portugal F16, Men Singles","ITF Men"
"ITF Portugal F16, Men Doubles","ITF Men"
"ITF Italy 22A, Women Singles","ITF Women"
"ITF Italy 22A, Women Doubles","ITF Women"
"ITF Spain 07B, Women Singles","ITF Women"
"ITF Poland 04A, Women Singles","ITF Women"
"ITF Poland 04A, Women Doubles","ITF Women"
"ITF Spain 07B, Women Doubles","ITF Women"
"ITF USA F6, Men Doubles","ITF Men"
"ITF Poland F9, Men Singles","ITF Men"
"ITF Poland F9, Men Doubles","ITF Men"
"ITF Belarus F2, Men Singles","ITF Men"
"ITF Belarus F2, Men Doubles","ITF Men"
"ITF Belgium F9, Men Singles","ITF Men"
"ITF Belgium F9, Men Doubles","ITF Men"
"ITF Finland F3, Men Singles","ITF Men"
"ITF Finland F3, Men Doubles","ITF Men"
"ITF Germany F11, Men Singles","ITF Men"
"ITF Germany F11, Men Doubles","ITF Men"
"ITF Netherlands F5, Men Singles","ITF Men"
"ITF Netherlands F5, Men Doubles","ITF Men"
"ITF Romania F10, Men Singles","ITF Men"
"ITF Romania F10, Men Doubles","ITF Men"
"ITF Russia F7, Men Singles","ITF Men"
"ITF Russia F7, Men Doubles","ITF Men"
"ITF Serbia F2, Men Singles","ITF Men"
"ITF Serbia F2, Men Doubles","ITF Men"
"ITF Spain F25, Men Singles","ITF Men"
"ITF Spain F25, Men Doubles","ITF Men"
"ITF Canada 01A, Women Singles","ITF Women"
"ITF Canada 01A, Women Doubles","ITF Women"
"ITF Germany 13A, Women Singles","ITF Women"
"ITF Germany 13A, Women Doubles","ITF Women"
"ITF Switzerland 03A, Women Singles","ITF Women"
"ITF Switzerland 03A, Women Doubles","ITF Women"
"ITF Thailand 12A, Women Singles","ITF Women"
"ITF Thailand 12A, Women Doubles","ITF Women"
"ITF Austria 02A, Women Singles","ITF Women"
"ITF Austria 02A, Women Doubles","ITF Women"
"ITF Thailand F6, Men Singles","ITF Men"
"ITF Thailand F6, Men Doubles","ITF Men"
"ITF Turkey F30, Men Singles","ITF Men"
"ITF Turkey F30, Men Doubles","ITF Men"
"ITF Netherlands 04A, Women Singles","ITF Women"
"ITF Netherlands 04A, Women Doubles","ITF Women"
"ITF Russia 06A, Women Singles","ITF Women"
"ITF Russia 06A, Women Doubles","ITF Women"
"ITF Spain 13A, Women Singles","ITF Women"
"ITF Spain 13A, Women Doubles","ITF Women"
"ITF Australia F1, Men Singles","ITF Men"
"ITF Australia F1, Men Doubles","ITF Men"
"ITF Canada F2, Men Singles","ITF Men"
"ITF Canada F2, Men Doubles","ITF Men"
"ITF Croatia F1, Men Singles","ITF Men"
"ITF Croatia F1, Men Doubles","ITF Men"
"ITF Egypt F8, Men Singles","ITF Men"
"ITF Egypt F8, Men Doubles","ITF Men"
"ITF France F5, Men Singles","ITF Men"
"ITF France F5, Men Doubles","ITF Men"
"ITF Japan F1, Men Singles","ITF Men"
"ITF Japan F1, Men Doubles","ITF Men"
"ITF Belgium F10, Men Singles","ITF Men"
"ITF Belgium F10, Men Doubles","ITF Men"
"ITF Italy F26, Men Singles","ITF Men"
"ITF Italy F26, Men Doubles","ITF Men"
"ITF Portugal F17, Men Singles","ITF Men"
"ITF Portugal F17, Men Doubles","ITF Men"
"ITF Romania F11, Men Singles","ITF Men"
"ITF Romania F11, Men Doubles","ITF Men"
"ITF Switzerland F4, Men Singles","ITF Men"
"ITF Switzerland F4, Men Doubles","ITF Men"
"ITF Turkiye 30A, Women Singles","ITF Women"
"ITF Turkiye 30A, Women Doubles","ITF Women"
"ITF Poland 05A, Women Singles","ITF Women"
"ITF Poland 05A, Women Doubles","ITF Women"
"ITF Turkey F12 Men Singles","ITF Men"
"ITF Turkey F12 Men Doubles","ITF Men"
"ITF Tunisia F12 Men Doubles","ITF Men"
"ITF Tunisia F12 Men Singles","ITF Men"
"ITF Portugal F4, Men Singles","ITF Men"
"ITF Portugal F4, Men Doubles","ITF Men"
"ITF Japan F4, Men Singles","ITF Men"
"ITF Japan F4, Men Doubles","ITF Men"
"ITF Israel F3, Men Singles","ITF Men"
"ITF Israel F3, Men Doubles","ITF Men"
"ITF Indonesia F4, Men Singles","ITF Men"
"ITF Indonesia F4, Men Doubles","ITF Men"
"ITF Greece F4, Men Singles","ITF Men"
"ITF Greece F4, Men Doubles","ITF Men"
"ITF Egypt F11, Men Singles","ITF Men"
"ITF Egypt F11, Men Doubles","ITF Men"
"ITF Bahrain F2, Men Singles","ITF Men"
"ITF Bahrain F2, Men Doubles","ITF Men"
"ITF Spain F9, Men Singles","ITF Men"
"ITF Spain F9, Men Doubles","ITF Men"
"ITF Italy F6, Men Singles","ITF Men"
"ITF Italy F6, Men Doubles","ITF Men"
"ITF Turkey F11, Men Singles","ITF Men"
"ITF Turkey F11, Men Doubles","ITF Men"
"ITF Tunisia F11, Men Singles","ITF Men"
"ITF Tunisia F11, Men Doubles","ITF Men"
"ITF Spain F8, Men Singles","ITF Men"
"ITF Spain F8, Men Doubles","ITF Men"
"ITF Japan F3, Men Singles","ITF Men"
"ITF Japan F3, Men Doubles","ITF Men"
"ITF Israel F2, Men Singles","ITF Men"
"ITF Israel F2, Men Doubles","ITF Men"
"ITF Poland F10, Men Singles","ITF Men"
"ITF Poland F10, Men Doubles","ITF Men"
"ITF Spain F26, Men Singles","ITF Men"
"ITF Spain F26, Men Doubles","ITF Men"
"ITF Turkey F31, Men Singles","ITF Men"
"ITF Turkey F31, Men Doubles","ITF Men"
"ITF Argentina F4, Men Singles","ITF Men"
"ITF Argentina F4, Men Doubles","ITF Men"
"ITF Belarus F3, Men Singles","ITF Men"
"ITF Belarus F3, Men Doubles","ITF Men"
"ITF Germany F12, Men Singles","ITF Men"
"ITF Germany F12, Men Doubles","ITF Men"
"ITF Netherlands F6, Men Singles","ITF Men"
"ITF Netherlands F6, Men Doubles","ITF Men"
"ITF Serbia F3, Men Singles","ITF Men"
"ITF Serbia F3, Men Doubles","ITF Men"
"ITF Germany 14A, Women Singles","ITF Women"
"ITF Germany 14A, Women Doubles","ITF Women"
"ITF Hungary 06A, Women Singles","ITF Women"
"ITF Hungary 06A, Women Doubles","ITF Women"
"ITF Japan 09A, Women Singles","ITF Women"
"ITF Japan 09A, Women Doubles","ITF Women"
"ITF Belgium 05A, Women Singles","ITF Women"
"ITF Belgium 05A, Women Doubles","ITF Women"
"ITF Italy 23A, Women Singles","ITF Women"
"ITF Italy 23A, Women Doubles","ITF Women"
"ITF Netherlands 05A, Women Singles","ITF Women"
"ITF Netherlands 05A, Women Doubles","ITF Women"
"ITF Romania 09A, Women Singles","ITF Women"
"ITF Romania 09A, Women Doubles","ITF Women"
"ITF Serbia 04A, Women Singles","ITF Women"
"ITF Serbia 04A, Women Doubles","ITF Women"
"ITF Switzerland 04A, Women Singles","ITF Women"
"ITF Switzerland 04A, Women Doubles","ITF Women"
"ITF Greece F3, Men Singles","ITF Men"
"ITF Greece F3, Men Doubles","ITF Men"
"ITF Egypt F10, Men Singles","ITF Men"
"ITF Egypt F10, Men Doubles","ITF Men"
"ITF Croatia F3, Men Singles","ITF Men"
"ITF Croatia F3, Men Doubles","ITF Men"
"ITF Bahrain F1, Men Singles","ITF Men"
"ITF Bahrain F1, Men Doubles","ITF Men"
"ITF USA F11, Men Singles","ITF Men"
"ITF USA F11, Men Doubles","ITF Men"
"ITF Italy F5, Men Singles","ITF Men"
"ITF Italy F5, Men Doubles","ITF Men"
"ITF Australia F3, Men Singles","ITF Men"
"ITF Australia F3, Men Doubles","ITF Men"
"ITF Turkey F10, Men Singles","ITF Men"
"ITF Turkey F10, Men Doubles","ITF Men"
"ITF Tunisia F10, Men Singles","ITF Men"
"ITF Tunisia F10, Men Doubles","ITF Men"
"ITF Japan F2, Men Singles","ITF Men"
"ITF Japan F2, Men Doubles","ITF Men"
"ITF Italy F4, Men Singles","ITF Men"
"ITF Italy F4, Men Doubles","ITF Men"
"ITF Israel F1, Men Singles","ITF Men"
"ITF Israel F1, Men Doubles","ITF Men"
"ITF India F5, Men Singles","ITF Men"
"ITF India F5, Men Doubles","ITF Men"
"ITF Portugal F2, Men Doubles","ITF Men"
"ITF Portugal F2, Men Singles","ITF Men"
"ITF Tunisia F9, Men Singles","ITF Men"
"ITF Tunisia F9, Men Doubles","ITF Men"
"ITF France F6, Men Singles","ITF Men"
"ITF France F6, Men Doubles","ITF Men"
"ITF Egypt F9, Men Singles","ITF Men"
"ITF Egypt F9, Men Doubles","ITF Men"
"ITF Turkey F9, Men Singles","ITF Men"
"ITF Turkey F9, Men Doubles","ITF Men"
"ITF Croatia F2, Men Singles","ITF Men"
"ITF Croatia F2, Men Doubles","ITF Men"
"ITF USA F10, Men Singles","ITF Men"
"ITF USA F10, Men Doubles","ITF Men"
"ITF China F4, Men Singles","ITF Men"
"ITF China F4, Men Doubles","ITF Men"
"ITF USA F15, Men Singles","ITF Men"
"ITF Italy F7, Men Singles","ITF Men"
"ITF USA F15, Men Doubles","ITF Men"
"ITF Italy F7, Men Doubles","ITF Men"
"ITF Spain F10, Men Singles","ITF Men"
"ITF Spain F10, Men Doubles","ITF Men"
"ITF Egypt F12, Men Singles","ITF Men"
"ITF Egypt F12, Men Doubles","ITF Men"
"ITF Turkey F16, Men Singles","ITF Men"
"ITF Turkey F16, Men Doubles","ITF Men"
"ITF Tunisia F16, Men Doubles","ITF Men"
"ITF Tunisia F16, Men Singles","ITF Men"
"ITF Greece F5, Men Singles","ITF Men"
"ITF Greece F5, Men Doubles","ITF Men"
"ITF Indonesia F5, Men Singles","ITF Men"
"ITF Indonesia F5, Men Doubles","ITF Men"
"ITF Spain F11, Men Singles","ITF Men"
"ITF Spain F11, Men Doubles","ITF Men"
"ITF Japan F5, Men Singles","ITF Men"
"ITF Japan F5, Men Doubles","ITF Men"
"ITF Portugal F5, Men Singles","ITF Men"
"ITF Portugal F5, Men Doubles","ITF Men"
"ITF Kazakhstan F5, Men Singles","ITF Men"
"ITF Kazakhstan F5, Men Doubles","ITF Men"
"ITF Qatar F1, Men Singles","ITF Men"
"ITF Qatar F1, Men Doubles","ITF Men"
"ITF Israel F4, Men Singles","ITF Men"
"ITF Israel F4, Men Doubles","ITF Men"
"ITF Tunisia F13, Men Singles","ITF Men"
"ITF Tunisia F13, Men Doubles","ITF Men"
"ITF Egypt F15, Men Singles","ITF Men"
"ITF Egypt F15, Men Doubles","ITF Men"
"ITF Turkey F13, Men Singles","ITF Men"
"ITF Turkey F13, Men Doubles","ITF Men"
"ITF Uzbekistan F2, Men Singles","ITF Men"
"ITF Uzbekistan F2, Men Doubles","ITF Men"
"ITF USA F13, Men Singles","ITF Men"
"ITF USA F13, Men Doubles","ITF Men"
"ITF Italy F10, Men Singles","ITF Men"
"ITF Italy F10, Men Doubles","ITF Men"
"ITF Egypt F13, Men Singles","ITF Men"
"ITF Egypt F13, Men Doubles","ITF Men"
"ITF Indonesia F6, Men Singles","ITF Men"
"ITF Indonesia F6, Men Doubles","ITF Men"
"ITF Italy F8, Men Singles","ITF Men"
"ITF Italy F8, Men Doubles","ITF Men"
"ITF Kazakhstan F3, Men Singles","ITF Men"
"ITF Kazakhstan F3, Men Doubles","ITF Men"
"ITF Portugal F6, Men Singles","ITF Men"
"ITF Portugal F6, Men Doubles","ITF Men"
"ITF Qatar F2, Men Singles","ITF Men"
"ITF Qatar F2, Men Doubles","ITF Men"
"ITF Tunisia F14, Men Singles","ITF Men"
"ITF Tunisia F14, Men Doubles","ITF Men"
"ITF Turkey F14, Men Singles","ITF Men"
"ITF Turkey F14, Men Doubles","ITF Men"
"ITF Italy F9, Men Singles","ITF Men"
"ITF Italy F9, Men Doubles","ITF Men"
"ITF Uzbekistan F1, Men Singles","ITF Men"
"ITF Uzbekistan F1, Men Doubles","ITF Men"
"ITF Egypt F14, Men Singles","ITF Men"
"ITF Egypt F14, Men Doubles","ITF Men"
"ITF France F8, Men Singles","ITF Men"
"ITF France F8, Men Doubles","ITF Men"
"ITF Kazakhstan F4, Men Singles","ITF Men"
"ITF Kazakhstan F4, Men Doubles","ITF Men"
"ITF Qatar F3, Men Singles","ITF Men"
"ITF Qatar F3, Men Doubles","ITF Men"
"ITF Tunisia F15, Men Singles","ITF Men"
"ITF Tunisia F15, Men Doubles","ITF Men"
"ITF Turkey F15, Men Singles","ITF Men"
"ITF Turkey F15, Men Doubles","ITF Men"
"ITF USA F14, Men Singles","ITF Men"
"ITF USA F14, Men Doubles","ITF Men"
"ITF France F9, Men Singles","ITF Men"
"ITF France F9, Men Doubles","ITF Men"
"ITF Nigeria F1, Men Singles","ITF Men"
"ITF Nigeria F1, Men Doubles","ITF Men"
"ITF Spain F12, Men Singles","ITF Men"
"ITF Spain F12, Men Doubles","ITF Men"
"ITF France F10, Men Singles","ITF Men"
"ITF France F10, Men Doubles","ITF Men"
"ITF Israel F5, Men Singles","ITF Men"
"ITF Israel F5, Men Doubles","ITF Men"
"ITF Italy F11, Men Singles","ITF Men"
"ITF Italy F11, Men Doubles","ITF Men"
"ITF Tunisia F17, Men Singles","ITF Men"
"ITF Tunisia F17, Men Doubles","ITF Men"
"ITF Turkey F17, Men Singles","ITF Men"
"ITF Turkey F17, Men Doubles","ITF Men"
"ITF USA F16, Men Singles","ITF Men"
"ITF USA F16, Men Doubles","ITF Men"
"ITF Nigeria F2, Men Singles","ITF Men"
"ITF Nigeria F2, Men Doubles","ITF Men"
"ITF Sweden F1, Men Singles","ITF Men"
"ITF Sweden F1, Men Doubles","ITF Men"
"ITF China F6, Men Singles","ITF Men"
"ITF China F6, Men Doubles","ITF Men"
"ITF Israel F6, Men Singles","ITF Men"
"ITF Israel F6, Men Doubles","ITF Men"
"ITF Mexico F3, Men Singles","ITF Men"
"ITF Mexico F3, Men Doubles","ITF Men"
"ITF Spain F13, Men Singles","ITF Men"
"ITF Spain F13, Men Doubles","ITF Men"
"ITF Tunisia F18, Men Singles","ITF Men"
"ITF Tunisia F18, Men Doubles","ITF Men"
"ITF Turkey F18, Men Singles","ITF Men"
"ITF Turkey F18, Men Doubles","ITF Men"
